{
  "schema": "borromean/1",
  "generated_by": "8672b2d",
  "params": {"prime_bound": 200, "residue_class": "1 mod 4", "n_primes": 21, "n_valid_triples": 122, "n_borromean": 63},
  "provenance": {"symbol": "src/redei/redei_symbol", "verified_by": ["invariance_redei_solution_choice", "invariance_sqrt_branch", "theorem_redei_reciprocity_s3", "anchor_redei_13_61_937_is_minus_1"]},
  "primes": [5,13,17,29,37,41,53,61,73,89,97,101,109,113,137,149,157,173,181,193,197],
  "triples": [{"p": [5,29,109], "s": 1},{"p": [5,29,149], "s": 1},{"p": [5,29,181], "s": -1},{"p": [5,41,61], "s": -1},{"p": [5,61,109], "s": -1},{"p": [5,61,149], "s": 1},{"p": [5,89,109], "s": 1},{"p": [5,101,181], "s": 1},{"p": [13,17,53], "s": -1},{"p": [13,17,101], "s": 1},{"p": [13,17,157], "s": -1},{"p": [13,29,53], "s": -1},{"p": [13,29,173], "s": 1},{"p": [13,29,181], "s": -1},{"p": [13,53,113], "s": 1},{"p": [13,61,113], "s": -1},{"p": [13,101,157], "s": 1},{"p": [13,101,181], "s": -1},{"p": [13,113,157], "s": -1},{"p": [13,113,173], "s": -1},{"p": [13,157,173], "s": -1},{"p": [17,53,89], "s": -1},{"p": [17,53,149], "s": -1},{"p": [17,89,157], "s": 1},{"p": [17,101,137], "s": 1},{"p": [17,101,157], "s": -1},{"p": [29,53,149], "s": 1},{"p": [29,53,197], "s": -1},{"p": [29,109,173], "s": -1},{"p": [29,109,197], "s": -1},{"p": [29,149,173], "s": 1},{"p": [29,173,197], "s": 1},{"p": [29,181,197], "s": 1},{"p": [37,41,73], "s": -1},{"p": [37,41,173], "s": 1},{"p": [37,41,197], "s": -1},{"p": [37,53,149], "s": 1},{"p": [37,53,197], "s": -1},{"p": [37,73,137], "s": 1},{"p": [37,73,149], "s": 1},{"p": [37,73,173], "s": -1},{"p": [37,73,181], "s": -1},{"p": [37,101,137], "s": -1},{"p": [37,101,157], "s": 1},{"p": [37,101,181], "s": 1},{"p": [37,101,197], "s": -1},{"p": [37,137,173], "s": 1},{"p": [37,137,181], "s": 1},{"p": [37,137,197], "s": 1},{"p": [37,149,173], "s": -1},{"p": [37,157,173], "s": 1},{"p": [37,157,197], "s": -1},{"p": [37,173,197], "s": -1},{"p": [37,181,197], "s": 1},{"p": [41,61,73], "s": 1},{"p": [41,61,113], "s": -1},{"p": [41,61,197], "s": 1},{"p": [41,73,173], "s": -1},{"p": [41,113,173], "s": -1},{"p": [41,173,197], "s": -1},{"p": [53,89,97], "s": 1},{"p": [53,97,113], "s": 1},{"p": [53,97,197], "s": 1},{"p": [53,113,149], "s": 1},{"p": [61,73,97], "s": -1},{"p": [61,73,109], "s": -1},{"p": [61,73,137], "s": 1},{"p": [61,73,149], "s": -1},{"p": [61,97,109], "s": 1},{"p": [61,97,113], "s": -1},{"p": [61,97,197], "s": 1},{"p": [61,109,113], "s": -1},{"p": [61,109,137], "s": -1},{"p": [61,109,197], "s": -1},{"p": [61,113,149], "s": -1},{"p": [61,137,197], "s": -1},{"p": [73,89,97], "s": 1},{"p": [73,89,109], "s": -1},{"p": [73,89,173], "s": -1},{"p": [73,97,109], "s": 1},{"p": [73,109,137], "s": 1},{"p": [73,109,173], "s": 1},{"p": [73,137,173], "s": 1},{"p": [73,137,181], "s": -1},{"p": [73,149,173], "s": 1},{"p": [89,97,109], "s": -1},{"p": [89,109,157], "s": -1},{"p": [89,109,173], "s": -1},{"p": [89,157,173], "s": -1},{"p": [97,101,193], "s": 1},{"p": [97,101,197], "s": -1},{"p": [97,109,113], "s": 1},{"p": [97,109,193], "s": -1},{"p": [97,109,197], "s": -1},{"p": [97,193,197], "s": 1},{"p": [101,137,181], "s": -1},{"p": [101,137,193], "s": 1},{"p": [101,137,197], "s": -1},{"p": [101,157,193], "s": -1},{"p": [101,157,197], "s": 1},{"p": [101,181,193], "s": -1},{"p": [101,181,197], "s": 1},{"p": [101,193,197], "s": 1},{"p": [109,113,157], "s": -1},{"p": [109,113,173], "s": 1},{"p": [109,137,173], "s": 1},{"p": [109,137,193], "s": 1},{"p": [109,137,197], "s": -1},{"p": [109,157,173], "s": -1},{"p": [109,157,193], "s": 1},{"p": [109,157,197], "s": 1},{"p": [109,173,197], "s": 1},{"p": [109,193,197], "s": -1},{"p": [113,149,173], "s": -1},{"p": [113,157,173], "s": 1},{"p": [137,173,197], "s": 1},{"p": [137,181,193], "s": 1},{"p": [137,181,197], "s": -1},{"p": [137,193,197], "s": -1},{"p": [157,173,197], "s": -1},{"p": [157,193,197], "s": 1},{"p": [181,193,197], "s": 1}]
}
